{
  "version": 1,
  "weapons": [
    {
      "name": "Astra Style-6",
      "type_code": "P",
      "accuracy": -1,
      "concealment": "P",
      "availability": "E",
      "damage": "1D6",
      "ammo_type": "5mm",
      "weapon_range_m": 50,
      "magazine_capacity": 6,
      "cadence_full_auto": 2,
      "reliability": "UR",
      "class": "Automáticas Leves",
      "price": 75,
      "Note": "Arma de reserva espanhola, comum e barata, feita de polímero e carregada com projéteis plásticos fragmentários de 5mm.",
      "id": "weapon_astra_style_6"
    },
    {
      "name": "BudgetArms C-13",
      "type_code": "P",
      "accuracy": -1,
      "concealment": "P",
      "availability": "E",
      "damage": "1D6",
      "ammo_type": "5mm",
      "weapon_range_m": 50,
      "magazine_capacity": 8,
      "cadence_full_auto": 2,
      "reliability": "ST",
      "class": "Automáticas Leves",
      "price": 75,
      "Note": "Pistola automática leve usada como arma de apoio, segunda arma ou 'arma de mulher'.",
      "id": "weapon_budgetarms_c_13"
    },
    {
      "name": "Dai Lung Cibermag 15",
      "type_code": "P",
      "accuracy": -1,
      "concealment": "P",
      "availability": "C",
      "damage": "1D6+1",
      "ammo_type": "6mm",
      "weapon_range_m": 50,
      "magazine_capacity": 10,
      "cadence_full_auto": 2,
      "reliability": "UR",
      "class": "Automáticas Leves",
      "price": 50,
      "Note": "Cópia barata de Hong Kong, muito usada por Boosters e pela escória das ruas.",
      "id": "weapon_dai_lung_cybermag_15"
    },
    {
      "name": "Federated Arms Impact",
      "type_code": "P",
      "accuracy": 1,
      "concealment": "J",
      "availability": "E",
      "damage": "1D6",
      "ammo_type": ".22",
      "weapon_range_m": 50,
      "magazine_capacity": 10,
      "cadence_full_auto": 2,
      "reliability": "VR",
      "class": "Automáticas Leves",
      "price": 60,
      "Note": "Pistola de baixo calibre com dez tiros e confiabilidade incomum.",
      "id": "weapon_federated_arms_impact"
    },
    {
      "name": "Federated Arms X-22",
      "type_code": "P",
      "accuracy": 0,
      "concealment": "J",
      "availability": "E",
      "damage": "1D6+1",
      "ammo_type": "6mm",
      "weapon_range_m": 50,
      "magazine_capacity": 10,
      "cadence_full_auto": 2,
      "reliability": "ST",
      "class": "Automáticas Leves",
      "price": 50,
      "price_max": 150,
      "Note": "Arma de polímero de tiro único, vendida em 13 cores. O modelo de 6mm custa 50-150eb; a versão sem cápsula de .22 causa 1D6 e custa 25-50eb.",
      "id": "weapon_federated_arms_x_22"
    },
    {
      "name": "Federated Arms X-38",
      "type_code": "P",
      "accuracy": 1,
      "concealment": "J",
      "availability": "E",
      "damage": "2D6",
      "ammo_type": ".38",
      "weapon_range_m": 50,
      "magazine_capacity": 10,
      "cadence_full_auto": 2,
      "reliability": "ST",
      "class": "Automáticas Leves",
      "price": 35,
      "Note": "Pistola automática barata de .38 sem cápsula.",
      "id": "weapon_federated_arms_x_38"
    },
    {
      "name": "Towa Manufacturing Type-12 Pistola Policial",
      "type_code": "P",
      "accuracy": 3,
      "concealment": "J",
      "availability": "P",
      "damage": "1D6+1",
      "ammo_type": "6mm",
      "weapon_range_m": 50,
      "magazine_capacity": 6,
      "cadence_full_auto": 2,
      "reliability": "VR",
      "class": "Automáticas Leves",
      "price": 450,
      "Note": "Arma curta padrão da polícia japonesa. A versão smartgun concede PA +5 e custa 810eb.",
      "id": "weapon_towa_manufacturing_type_12_police_pistol"
    },
    {
      "name": "Arasaka WSA Pistola Automática",
      "type_code": "P",
      "accuracy": 0,
      "concealment": "J",
      "availability": "C",
      "damage": "2D6+3",
      "ammo_type": "10mm",
      "weapon_range_m": 50,
      "magazine_capacity": 15,
      "cadence_full_auto": 2,
      "reliability": "VR",
      "class": "Automáticas Médias",
      "price": 400,
      "Note": "Arma curta padrão das tropas e dos executivos da Arasaka.",
      "id": "weapon_arasaka_wsa_autopistol"
    },
    {
      "name": "BudgetArms C-41",
      "type_code": "P",
      "accuracy": 1,
      "concealment": "J",
      "availability": "E",
      "damage": "2D6+1",
      "ammo_type": ".41 Cased",
      "weapon_range_m": 50,
      "magazine_capacity": 10,
      "cadence_full_auto": 3,
      "reliability": "VR",
      "class": "Automáticas Médias",
      "price": 600,
      "Note": "Pistola de grande calibre, dez tiros e boa confiabilidade.",
      "id": "weapon_budgetarms_c_41"
    },
    {
      "name": "BudgetArms Laser-Niner",
      "type_code": "P",
      "accuracy": 1,
      "concealment": [
        "J",
        "L"
      ],
      "availability": "P",
      "damage": "2D6+1",
      "ammo_type": "9mm",
      "weapon_range_m": 50,
      "magazine_capacity": [
        15,
        35
      ],
      "cadence_full_auto": [
        3,
        20
      ],
      "reliability": "ST",
      "class": "Automáticas Médias",
      "price": 675,
      "Note": "Mira laser integral. Configuração padrão J/15/3; com o pente de assalto, S/35/20.",
      "id": "weapon_budgetarms_laser_niner"
    },
    {
      "name": "Beretta M97P",
      "type_code": "P",
      "accuracy": 2,
      "concealment": "J",
      "availability": "P",
      "damage": "2D6+1",
      "ammo_type": "9mm",
      "weapon_range_m": 50,
      "magazine_capacity": 18,
      "cadence_full_auto": 2,
      "reliability": "VR",
      "class": "Automáticas Médias",
      "price": 480,
      "Note": "Mira laser integral. Usa munição Plasticase.",
      "id": "weapon_beretta_m97p"
    },
    {
      "name": "CCMMC Goaxing Xiuxi CM-3",
      "type_code": "P",
      "accuracy": 0,
      "concealment": "J",
      "availability": "C",
      "damage": "2D6+1",
      "ammo_type": "9mm",
      "weapon_range_m": 50,
      "magazine_capacity": 8,
      "cadence_full_auto": 2,
      "reliability": "ST",
      "class": "Automáticas Médias",
      "price": 75,
      "Note": "A arma mais potente que um civil pode possuir legalmente na China continental; indisponível fora do país.",
      "id": "weapon_ccmmc_goaxing_xiuxi_cm_3"
    },
    {
      "name": "Colt Alpha-Omega Pistola de Competição (.45 ACP)",
      "type_code": "P",
      "accuracy": 2,
      "concealment": "J",
      "availability": "C",
      "damage": "2D6+2",
      "ammo_type": ".45 ACP",
      "weapon_range_m": 50,
      "magazine_capacity": 10,
      "cadence_full_auto": 2,
      "reliability": "VR",
      "class": "Automáticas Médias",
      "price": 500,
      "Note": "Pode receber um sistema de mira Nikon COT por mais 3.900eb.",
      "id": "weapon_colt_alpha_omega_competition_pistol_45_acp"
    },
    {
      "name": "Colt Alpha-Omega Pistola de Competição (10mm)",
      "type_code": "P",
      "accuracy": 2,
      "concealment": "J",
      "availability": "C",
      "damage": "2D6+3",
      "ammo_type": "10mm",
      "weapon_range_m": 50,
      "magazine_capacity": 10,
      "cadence_full_auto": 2,
      "reliability": "VR",
      "class": "Automáticas Médias",
      "price": 500,
      "Note": "Pode receber um sistema de mira Nikon COT por mais 3.900eb.",
      "id": "weapon_colt_alpha_omega_competition_pistol_10mm"
    },
    {
      "name": "Colt Enforcement 10 Arma Curta (Básica)",
      "type_code": "P",
      "accuracy": 1,
      "concealment": "J",
      "availability": "C",
      "damage": "2D6+3",
      "ammo_type": "10mm",
      "weapon_range_m": 50,
      "magazine_capacity": 14,
      "cadence_full_auto": 2,
      "reliability": "VR",
      "class": "Automáticas Médias",
      "price": 550,
      "Note": "O smartchip acrescenta 550eb ao preço.",
      "id": "weapon_colt_enforcement_10_sidearm_basic"
    },
    {
      "name": "Colt Enforcement 10 Arma Curta (Camuflada)",
      "type_code": "P",
      "accuracy": 1,
      "concealment": "J",
      "availability": "C",
      "damage": "2D6+3",
      "ammo_type": "10mm",
      "weapon_range_m": 50,
      "magazine_capacity": 14,
      "cadence_full_auto": 2,
      "reliability": "VR",
      "class": "Automáticas Médias",
      "price": 600,
      "Note": "O smartchip acrescenta 550eb ao preço.",
      "id": "weapon_colt_enforcement_10_sidearm_camouflaged"
    },
    {
      "name": "Dai Lung Street Master",
      "type_code": "P",
      "accuracy": 0,
      "concealment": "J",
      "availability": "E",
      "damage": "2D6+3",
      "ammo_type": "10mm",
      "weapon_range_m": 50,
      "magazine_capacity": 12,
      "cadence_full_auto": 2,
      "reliability": "UR",
      "class": "Automáticas Médias",
      "price": 200,
      "Note": "Outra arma barata da Dai Lung, feita para as ruas.",
      "id": "weapon_dai_lung_streetmaster"
    },
    {
      "name": "FN Browning \"3-Spot\" Pistola-Metralhadora",
      "type_code": "P",
      "accuracy": 1,
      "concealment": "J",
      "availability": "C",
      "damage": "2D6+3",
      "ammo_type": "10mm",
      "weapon_range_m": 50,
      "magazine_capacity": 24,
      "cadence_full_auto": 3,
      "reliability": "ST",
      "class": "Automáticas Médias",
      "price": 425,
      "Note": "Dispara uma rajada de três tiros a cada acionamento do gatilho.",
      "id": "weapon_fn_browning_3_spot_machine_pistol"
    },
    {
      "name": "Federated Arms X-9mm",
      "type_code": "P",
      "accuracy": 0,
      "concealment": "J",
      "availability": "E",
      "damage": "2D6+1",
      "ammo_type": "9mm",
      "weapon_range_m": 50,
      "magazine_capacity": 12,
      "cadence_full_auto": 2,
      "reliability": "ST",
      "class": "Automáticas Médias",
      "price": 300,
      "Note": "Arma curta robusta, usada pelas milícias estaduais dos Estados Unidos.",
      "id": "weapon_federated_arms_x_9mm"
    },
    {
      "name": "Fashion Gun 9",
      "type_code": "P",